"Authors","Author full names","Author(s) ID","Title","Year","Source title","Volume","Issue","Art. No.","Page start","Page end","Cited by","DOI","Link","Document Type","Publication Stage","Open Access","Source","EID"
"Briatore F.; Vanni F.; Mosca R.; Mosca M.","Briatore, Federico (57870171600); Vanni, Francesca (59912742600); Mosca, Roberto (35846137900); Mosca, Marco (32367794300)","57870171600; 59912742600; 35846137900; 32367794300","Enhancing supply chain resilience: The impact of 4.0 technologies","2025","Journal of Transport and Supply Chain Management","19","","a1107","","","2","10.4102/jtscm.v19i0.1107","https://www.scopus.com/pages/publications/105007562695?origin=resultslist","Article","Final","All Open Access; Gold Open Access; Green Open Access","Scopus","2-s2.0-105007562695"
"Kadam S.; Raj C.; Anawade P.; Sharma D.; Wanjari U.; Shirbhate J.; Pipare S.","Kadam, Shubham (59202919100); Raj, Chhitij (60099510900); Anawade, Pankajkumar (59259557300); Sharma, Deepak (58601890500); Wanjari, Utkarsha (60143747600); Shirbhate, Janhvi (60162728700); Pipare, Sharvari (60162910800)","59202919100; 60099510900; 59259557300; 58601890500; 60143747600; 60162728700; 60162910800","AI-Driven Optimization in Healthcare Supply Chains","2026","Lecture Notes in Networks and Systems","1461 LNNS","","","421","430","0","10.1007/978-981-96-7508-1_38","https://www.scopus.com/pages/publications/105020254252?origin=resultslist","Conference paper","Final","","Scopus","2-s2.0-105020254252"
"Haddud A.","Haddud, Abubaker (57191597449)","57191597449","ChatGPT in supply chains: exploring potential applications, benefits and challenges","2024","Journal of Manufacturing Technology Management","35","7","","1293","1312","27","10.1108/JMTM-02-2024-0075","https://www.scopus.com/pages/publications/85195315311?origin=resultslist","Article","Final","","Scopus","2-s2.0-85195315311"
"Chowdhury S.; Mishra S.; Sharma N.; Reddy P.S.; Sharma Y.K.; Tyagi A.","Chowdhury, Soummya (59761904300); Mishra, Shobha (59810225500); Sharma, Neeraj (59894861600); Reddy, P. Srinivas (57823845500); Sharma, Yogesh Kumar (59559265300); Tyagi, Ayushi (58893570300)","59761904300; 59810225500; 59894861600; 57823845500; 59559265300; 58893570300","Machine Learning Models for Enhancing Time Series Demand Forecasting in Business Intelligence","2024","Proceedings of International Conference on Emerging Technologies and Innovation for Sustainability, EmergIN 2024","","","","78","84","4","10.1109/EmergIN63207.2024.10961109","https://www.scopus.com/pages/publications/105004643276?origin=resultslist","Conference paper","Final","","Scopus","2-s2.0-105004643276"
"Samuels A.","Samuels, Alexander (59536943900)","59536943900","Examining the integration of artificial intelligence in supply chain management from Industry 4.0 to 6.0: a systematic literature review","2024","Frontiers in Artificial Intelligence","7","","1477044","","","62","10.3389/frai.2024.1477044","https://www.scopus.com/pages/publications/85216581349?origin=resultslist","Review","Final","All Open Access; Gold Open Access; Green Open Access","Scopus","2-s2.0-85216581349"
"Kumcu E.H.; Khanna M.; Khanna M.; Chand K.","Kumcu, Elif Hasret (59948672700); Khanna, Monika (58871115000); Khanna, Manisha (60601846100); Chand, Khem (56740517500)","59948672700; 58871115000; 60601846100; 56740517500","Smart Supply Chains: Leveraging AI and BI for Better Decision-Making in Logistics","2026","Transforming Financial Management with AI, BI, and Data-Driven Decision Making","","","","181","205","1","10.1108/978-1-80592-911-620261009","https://www.scopus.com/pages/publications/105039719185?origin=resultslist","Book chapter","Final","","Scopus","2-s2.0-105039719185"
"Sharma A.; Singh J.; Sharma P.; Kumar V.; Sharma M.; Singh R.","Sharma, Anshul (60174451600); Singh, Jagendra (56347348900); Sharma, Preeti (59067375600); Kumar, Vinish (57197697410); Sharma, Meenakshi (56287966900); Singh, Ramendra (57213969823)","60174451600; 56347348900; 59067375600; 57197697410; 56287966900; 57213969823","Applying Machine Learning and Swarm Optimization Techniques for Real-Time Decision-Making in Supply Chain Management","2026","Lecture Notes in Networks and Systems","1359 LNNS","","","79","93","2","10.1007/978-981-96-4933-4_7","https://www.scopus.com/pages/publications/105020754447?origin=resultslist","Conference paper","Final","","Scopus","2-s2.0-105020754447"
"Kolasani S.","Kolasani, Saydulu (59153538800)","59153538800","Innovative Applications of AI for Sustainable Supply Chain Management in Environmental Conservation","2024","Artificial Intelligence and Machine Learning for Sustainable Development: Innovations, Challenges, and Applications","","","","158","171","2","10.1201/9781003497189-12","https://www.scopus.com/pages/publications/85210865295?origin=resultslist","Book chapter","Final","","Scopus","2-s2.0-85210865295"
"Raikar T.; Ezeugboaja F.; Bussa S.; Upadhyay H.; Kalaru P.","Raikar, Trupti (60595317600); Ezeugboaja, Favour (60594639900); Bussa, Santhosh (59702621800); Upadhyay, Hemang (60595084900); Kalaru, Poojitha (60595317700)","60595317600; 60594639900; 59702621800; 60595084900; 60595317700","Ethics of AI-based supply chain optimization: a better balance between efficiency and fairness","2026","Future Technology","5","2","","281","296","0","10.55670/fpll.futech.5.2.26","https://www.scopus.com/pages/publications/105036512144?origin=resultslist","Article","Final","All Open Access; Gold Open Access","Scopus","2-s2.0-105036512144"
"Messour M.; Fedouaki F.","Messour, Manar (59755196000); Fedouaki, Fayçal (57211627819)","59755196000; 57211627819","Enhancing the Reliability of Kanban Systems with AI Tools in the Automotive Sector: A Case Study","2025","Sustainable Civil Infrastructures","","","","521","529","0","10.1007/978-3-031-86705-7_49","https://www.scopus.com/pages/publications/105003633379?origin=resultslist","Conference paper","Final","","Scopus","2-s2.0-105003633379"
"Allahham M.; Sharabati A.A.; Hatamlah H.; Ahmad A.Y.B.; Sabra S.; Daoud M.K.","Allahham, Mahmoud (58784860500); Sharabati, Abdel-Aziz Ahmad (35424614700); Hatamlah, Heba (57973379300); Ahmad, Ahmad Yahiya Bani (58480930900); Sabra, Samar (58694749800); Daoud, Mohammad Khalaf (58504819400)","58784860500; 35424614700; 57973379300; 58480930900; 58694749800; 58504819400","Big Data Analytics and AI for Green Supply Chain Integration and Sustainability in Hospitals","2023","WSEAS Transactions on Environment and Development","19","","","1218","1230","48","10.37394/232015.2023.19.111","https://www.scopus.com/pages/publications/85182981898?origin=resultslist","Article","Final","All Open Access; Gold Open Access","Scopus","2-s2.0-85182981898"
"Jauhar S.K.; Harinath S.; Krishnaswamy V.; Paul S.K.","Jauhar, Sunil Kumar (56022578600); Harinath, Susmitha (59383654700); Krishnaswamy, Venkataraghavan (56239600300); Paul, Sanjoy Kumar (9246007500)","56022578600; 59383654700; 56239600300; 9246007500","Explainable artificial intelligence to improve the resilience of perishable product supply chains by leveraging customer characteristics","2025","Annals of Operations Research","354","1","","103","142","18","10.1007/s10479-024-06348-z","https://www.scopus.com/pages/publications/85207350670?origin=resultslist","Article","Final","All Open Access; Hybrid Gold Open Access","Scopus","2-s2.0-85207350670"
"Kemmner G.-A.","Kemmner, Götz-Andreas (6505901837)","6505901837","Optimization of Product Availability and Detailed Resource Planning AI-based Supply Chain Management Delivers Much More Than Just Better Sales Fore-casts.; [Optimierung der Lieferfähigkeit und Feinplanung KI-Mechanismen im Supply Chain Management helfen nicht nur bei Absatzprognosen]","2022","ZWF Zeitschrift fuer Wirtschaftlichen Fabrikbetrieb","117","3","","164","168","0","10.1515/zwf-2022-1033","https://www.scopus.com/pages/publications/85127148398?origin=resultslist","Article","Final","","Scopus","2-s2.0-85127148398"
"Ma X.; Zhao L.; Zhang L.; Chen X.","Ma, Xiang (57412908300); Zhao, Linlin (56701224100); Zhang, Liyuan (55976806500); Chen, Xiangjie (57437937300)","57412908300; 56701224100; 55976806500; 57437937300","The Impact of Artificial Intelligence-Enabled Supply Chain Management on Firm Performance: Evidence from Operational Efficiency and Risk Mitigation Mechanisms","2026","Proceedings of 2026 International Conference on Artificial Intelligence and Fintech, IC-AIF 2026","","","","261","265","0","10.1145/3800973.3801013","https://www.scopus.com/pages/publications/105039101428?origin=resultslist","Conference paper","Final","","Scopus","2-s2.0-105039101428"
"Salaysay D.A.L.; De Vera V.J.D.; Sedilla R.B.; Lavadia L.L.A.; Buenavidez C.E.J.A.; Sunico V.A.J.C.; Alano W.A.L.","Salaysay, Dana Althea L. (60649670300); De Vera, Van Julian D. (60656032400); Sedilla, Raymond B. (59506283700); Lavadia, Lyeonna Lorisse A. (60656460800); Buenavidez, Czarina Erin Jan A. (60656086000); Sunico, Vince Alfred John C. (60656213100); Alano, Wyatt Ace L. (60656460900)","60649670300; 60656032400; 59506283700; 60656460800; 60656086000; 60656213100; 60656460900","Artificial Intelligence Algorithms in Optimization of Supply Chain Networks","2026","2026 International Conference on Advances in Artificial Intelligence and Machine Learning, AAIML 2026","","","","860","864","0","10.1109/AAIML67890.2026.11498185","https://www.scopus.com/pages/publications/105040550761?origin=resultslist","Conference paper","Final","","Scopus","2-s2.0-105040550761"
"Onorio P.O.; Frazzon E.M.; Leusin M.E.; Cordes C.; Azevedo V.","Onorio, Pedro O. (60138128300); Frazzon, Enzo M. (35791521500); Leusin, Matheus E. (57203768307); Cordes, Christian (35581122700); Azevedo, Vitor (57183813100)","60138128300; 35791521500; 57203768307; 35581122700; 57183813100","Artificial Intelligence Supporting Human Intelligence: Impacts on Supply Chains of Small and Medium Enterprises","2026","Procedia Computer Science","277","","","2485","2494","0","10.1016/j.procs.2026.02.285","https://www.scopus.com/pages/publications/105040147307?origin=resultslist","Conference paper","Final","All Open Access; Gold Open Access","Scopus","2-s2.0-105040147307"
"Olatunji A.O.; Gyamfi L.N.; Abubakar S.A.; Mirambo J.B.; Kim K.; Jide-Jegede M.; Shehu T.S.; Giwa A.A.","Olatunji, Aishat Oluwatoyin (60586947300); Gyamfi, Lisa Nyarko (60587605500); Abubakar, Sadiq Adamu (60429277300); Mirambo, Juliet Bosibori (60587386400); Kim, Keon (60586284300); Jide-Jegede, Mofeoluwa (58979102900); Shehu, Titilayo Silifat (60587605600); Giwa, Abdussobur Adebayo (60586729600)","60586947300; 60587605500; 60429277300; 60587386400; 60586284300; 58979102900; 60587605600; 60586729600","A Deep Reinforcement Learning Framework for Dynamic Inventory Control and Cost Optimization under Demand Uncertainty","2026","IEEE Access","14","","","58800","58818","0","10.1109/ACCESS.2026.3683065","https://www.scopus.com/pages/publications/105036009357?origin=resultslist","Article","Final","All Open Access; Gold Open Access; Green Open Access","Scopus","2-s2.0-105036009357"
"Seknametla P.R.","Seknametla, Pruthvi Raj (60058914100)","60058914100","Autonomous cloud infrastructure in the food industry: Leveraging AI for intelligent orchestration and monitoring","2025","Modernizing the Food Industry: AI-Powered Infrastructure, Security, and Supply Chain Innovation","","","","121","144","0","10.4018/979-8-3373-5288-6.ch006","https://www.scopus.com/pages/publications/105013920410?origin=resultslist","Book chapter","Final","","Scopus","2-s2.0-105013920410"
"Karropoulos E.; Psomiadi A.","Karropoulos, Eleftherios (60259781100); Psomiadi, Anastasia (59931206400)","60259781100; 59931206400","AI Development, Governance, and Regulation in Food Distribution","2026","Legal and Regulatory Impacts on AI Development","","","","95","116","0","10.4018/979-8-3373-7996-8.ch003","https://www.scopus.com/pages/publications/105037788030?origin=resultslist","Book chapter","Final","","Scopus","2-s2.0-105037788030"
"Shareef D.K.; Abdulla S.; Prasad P.M.; Ajay P.; Lakshmanudu M.","Shareef, D.K. (58527415600); Abdulla, Shaik (60601939600); Prasad, Pulagari Maruthi (60602048700); Ajay, Paseddula (60601936900); Lakshmanudu, M. (60602701100)","58527415600; 60601939600; 60602048700; 60601936900; 60602701100","An Intelligent Blockchain IoT Driven Supply Chain Finance Framework with Real-Time Inventory Analytics and Predictive Decision Support","2026","Proceedings of 8th International Conference on Intelligent Sustainable Systems, ICISS 2026","","","","1286","1293","0","10.1109/ICISS67859.2026.11453973","https://www.scopus.com/pages/publications/105036951413?origin=resultslist","Conference paper","Final","","Scopus","2-s2.0-105036951413"
"Li J.; Huang H.; Gong Y.; Wang L.; Yin X.; Liu Y.","Li, Jinjin (57223712245); Huang, Huijun (60263390300); Gong, Yuping (60263467100); Wang, Lei (60263507400); Yin, Xiangui (60263467200); Liu, Yichang (60015023100)","57223712245; 60263390300; 60263467100; 60263507400; 60263467200; 60015023100","A Review of Artificial Intelligence in Inventory Management: Methods, Applications and Directions","2025","International Journal of Advanced Computer Science and Applications","16","10","","915","928","0","10.14569/IJACSA.2025.0161090","https://www.scopus.com/pages/publications/105026334591?origin=resultslist","Article","Final","","Scopus","2-s2.0-105026334591"
"Sophia V.; Siham J.","Sophia, Vandapuye (58958968800); Siham, Jabraoui (57221962019)","58958968800; 57221962019","Artificial Intelligence and the Supply Chain: An AHP Approach to Select the Best AI Tools","2025","International Conference on Logistics, LOGISTIQUA","","2025","","","","1","10.1109/LOGISTIQUA66323.2025.11122796","https://www.scopus.com/pages/publications/105030541761?origin=resultslist","Conference paper","Final","","Scopus","2-s2.0-105030541761"
"Mohanty S.N.; Nanjundan P.; Kar T.","Mohanty, Sachi Nandan (36170793300); Nanjundan, Preethi (57220784492); Kar, Tejaswini (57189231239)","36170793300; 57220784492; 57189231239","Artificial Intelligence in Forecasting: Tools and Techniques","2024","Artificial Intelligence in Forecasting: Tools and Techniques","","","","1","356","1","10.1201/9781003399292","https://www.scopus.com/pages/publications/85195926047?origin=resultslist","Book","Final","","Scopus","2-s2.0-85195926047"
"Sekti B.A.","Sekti, Binastya Anggara (58083831000)","58083831000","Machine learning and artificial intelligence (AI) in manufacturing","2025","Integrating Digital Innovation and Integrated Frameworks in Manufacturing","","","","255","292","21","10.4018/979-8-3373-1082-4.ch011","https://www.scopus.com/pages/publications/105012172161?origin=resultslist","Book chapter","Final","","Scopus","2-s2.0-105012172161"
"Barala S.; Manimaran A.; Natarajan A.K.","Barala, Sourabh (59787263900); Manimaran, A. (57950691900); Natarajan, Arul Kumar (55602548600)","59787263900; 57950691900; 55602548600","Optimizing supply chain with AI-powered BI systems","2024","AI-Powered Business Intelligence for Modern Organizations","","","","159","180","0","10.4018/979-8-3693-8844-0.ch007","https://www.scopus.com/pages/publications/105004527283?origin=resultslist","Book chapter","Final","","Scopus","2-s2.0-105004527283"
"Kalisetty S.; Saradhi K.S.","Kalisetty, Srinivas (60642533400); Saradhi, Kanthety Sundeep (60389525100)","60642533400; 60389525100","Revolutionizing Retail Operations: Srinivas's AI-Driven Approach to Demand Forecasting and Seamless Supply Chain Management","2024","Utilitas Mathematica","121","","","489","500","0","","https://www.scopus.com/pages/publications/105016104085?origin=resultslist","Article","Final","","Scopus","2-s2.0-105016104085"
"Straka M.; Kleinová K.","Straka, Martin (36775833200); Kleinová, Kristína (59305486200)","36775833200; 59305486200","Deep Learning-Enhanced Proactive Strategy: LSTM and VRP/ACO for Autonomous Replenishment and Demand Forecasting in Shared Logistics","2026","Applied Sciences (Switzerland)","16","6","2838","","","0","10.3390/app16062838","https://www.scopus.com/pages/publications/105033857182?origin=resultslist","Article","Final","All Open Access; Gold Open Access; Green Open Access","Scopus","2-s2.0-105033857182"
"Koshy N.S.","Koshy, Nicy Susan (59516097300)","59516097300","A Study on Supply Chain Management of LNG Using Artificial Intelligence","2024","Society of Petroleum Engineers - ADIPEC 2024","","","","","","0","10.2118/222919-MS","https://www.scopus.com/pages/publications/85215114685?origin=resultslist","Conference paper","Final","","Scopus","2-s2.0-85215114685"
"Trushkina N.; Relawati R.; Harmash O.; Prokopyshyn O.; Chernukh D.; Shkrygun Y.","Trushkina, Nataliia (57210808778); Relawati, Rahayu (57203370124); Harmash, Oleh (58891522700); Prokopyshyn, Oksana (57929185900); Chernukh, Diana (60648498700); Shkrygun, Yuliya (58775341000)","57210808778; 57203370124; 58891522700; 57929185900; 60648498700; 58775341000","Artificial Intelligence and Logistics Management in the Agricultural Sector: Bibliometric Analysis and Conceptual Model","2025","Proceedings of International Conference on Applied Innovation in IT","13","5","","827","839","0","","https://www.scopus.com/pages/publications/105039978318?origin=resultslist","Conference paper","Final","","Scopus","2-s2.0-105039978318"
"Laldin Ismaeil M.K.; Lalla A.F.","Laldin Ismaeil, Mohamed Kama (59384628700); Lalla, Adam Fad (59323410400)","59384628700; 59323410400","The Role and Impact of Artificial Intelligence on Supply Chain Management: Efficiency, Challenges, and Strategic Implementation","2024","Journal of Ecohumanism","3","4","","89","106","28","10.62754/joe.v3i4.3461","https://www.scopus.com/pages/publications/85203719872?origin=resultslist","Article","Final","All Open Access; Hybrid Gold Open Access","Scopus","2-s2.0-85203719872"
"Tundys B.; Grzybowska K.","Tundys, Blanka (56158452500); Grzybowska, Katarzyna (16177250800)","56158452500; 16177250800","Adoption of Artificial Intelligence in Supply Chains: A Business Perspective","2026","Lecture Notes in Networks and Systems","1643 LNNS","","","3","14","0","10.1007/978-3-032-06611-4_1","https://www.scopus.com/pages/publications/105020022944?origin=resultslist","Conference paper","Final","","Scopus","2-s2.0-105020022944"
"Sathish T.; Akhil; Arunachalam S.J.","Sathish, T. (56736457800); Akhil (60045601800); Arunachalam, S. Jothi (59151132200)","56736457800; 60045601800; 59151132200","Comparing demand forecast by supply chain network optimization model (SCNOM) with the regression model for improving efficiency in meeting demands","2025","AIP Conference Proceedings","3300","1","020255","","","0","10.1063/5.0277188","https://www.scopus.com/pages/publications/105013192139?origin=resultslist","Conference paper","Final","","Scopus","2-s2.0-105013192139"
"Zhao Y.; Zhang M.; Mujumdar A.S.; Adhikari B.; Rui L.","Zhao, Yonggan (57211015280); Zhang, Min (36047275100); Mujumdar, Arun S. (57195520301); Adhikari, Benu (7006252058); Rui, Luming (58980732600)","57211015280; 36047275100; 57195520301; 7006252058; 58980732600","AI-based low-altitude delivery fresh food supply Chain: Research progress and trends","2025","Trends in Food Science and Technology","161","","105056","","","11","10.1016/j.tifs.2025.105056","https://www.scopus.com/pages/publications/105003822197?origin=resultslist","Review","Final","","Scopus","2-s2.0-105003822197"
"Al Awadh M.; Karthick K.K.; Ramachandran K.K.","Al Awadh, Mohammed (59454684600); Karthick, K.K. (55346090000); Ramachandran, K.K. (55345232700)","59454684600; 55346090000; 55345232700","Cognitive Computing in E-Commerce Enhancing Supply Chain Management","2024","Proceedings of International Conference on Contemporary Computing and Informatics, IC3I 2024","","","","1643","1648","1","10.1109/IC3I61595.2024.10828662","https://www.scopus.com/pages/publications/85217405416?origin=resultslist","Conference paper","Final","","Scopus","2-s2.0-85217405416"
"Kavitha R.K.; Jaisingh W.; Kaarthiekheyan V.; Jalaja Jayalakshmi V.; Sathyavathi S.","Kavitha, R.K. (56694327500); Jaisingh, W. (55790917300); Kaarthiekheyan, V. (58654206400); Jalaja Jayalakshmi, V. (60521668000); Sathyavathi, S. (57205561000)","56694327500; 55790917300; 58654206400; 60521668000; 57205561000","Artificial Intelligence and Machine Learning for Supply Chain Management Operations","2026","Industry 6.0 and Digital Transformation in Supply Chain, Assets, and Services","","","","33","63","0","10.4018/979-8-3373-9554-8.ch002","https://www.scopus.com/pages/publications/105033815427?origin=resultslist","Book chapter","Final","","Scopus","2-s2.0-105033815427"
"Mirbagheri S.","Mirbagheri, Sharareh (58847536000)","58847536000","Leveraging Data Warehousing and Decision Support Systems for Effective Supply Chain Management","2023","Proceedings - 2023 IEEE 8th International Conference on Smart Cloud, SmartCloud 2023","","","","111","115","4","10.1109/SmartCloud58862.2023.00028","https://www.scopus.com/pages/publications/85183317929?origin=resultslist","Conference paper","Final","","Scopus","2-s2.0-85183317929"
"","","","International Conference on Modelling Strategies in Mathematics, ICMSM 2024","2025","AIP Conference Proceedings","3306","1","","","","0","","https://www.scopus.com/pages/publications/105008868497?origin=resultslist","Conference review","Final","","Scopus","2-s2.0-105008868497"
"Muloor K.H.; Shankar Iyer L.; Saseekala M.; Manu K.S.","Muloor, Kiran Hemanthaj (58393620000); Shankar Iyer, Lakshmi (60328712200); Saseekala, M. (57201290889); Manu, K.S. (57218762959)","58393620000; 60328712200; 57201290889; 57218762959","The role of IoT in optimizing quick commerce operations: a comprehensive analysis of micro-fulfillment centers and consumer satisfaction","2025","IoT Security: Fundamentals and Key Enabling Technologies","","","","473","487","1","10.1016/B978-0-443-34125-0.00014-3","https://www.scopus.com/pages/publications/105026989292?origin=resultslist","Book chapter","Final","","Scopus","2-s2.0-105026989292"
"Kudrenko I.","Kudrenko, Ivan (58846928700)","58846928700","Navigating the Future: AI-Driven Healthcare Supply Chains","2024","Integrated Science","27","","","553","570","4","10.1007/978-3-031-70292-1_26","https://www.scopus.com/pages/publications/85219635028?origin=resultslist","Book chapter","Final","","Scopus","2-s2.0-85219635028"
"Zhai C.; Xiang F.; Liu Y.; Xu H.; Zhou L.; Zhang X.","Zhai, ChengGong (57202983026); Xiang, Fei (58999631500); Liu, YiWei (57226325111); Xu, HongSi (57218501730); Zhou, LiYong (57222614144); Zhang, Xing (57210291320)","57202983026; 58999631500; 57226325111; 57218501730; 57222614144; 57210291320","Research on the Application of Artificial Intelligence Technology in Material Support","2023","ACM International Conference Proceeding Series","","","","15","18","0","10.1145/3640771.3640776","https://www.scopus.com/pages/publications/85191146291?origin=resultslist","Conference paper","Final","","Scopus","2-s2.0-85191146291"
"Jasiński P.","Jasiński, Piotr (60645376900)","60645376900","The demand planning renaissance: A data-driven approach","2024","Journal of Supply Chain Management, Logistics and Procurement","7","1","","6","27","1","10.69554/XMOB6236","https://www.scopus.com/pages/publications/105039747514?origin=resultslist","Article","Final","","Scopus","2-s2.0-105039747514"
"Fu W.; Chien C.-F.","Fu, Wenhan (57193426714); Chien, Chen-Fu (57219656467)","57193426714; 57219656467","UNISON data-driven intermittent demand forecast framework to empower supply chain resilience and an empirical study in electronics distribution","2019","Computers and Industrial Engineering","135","","","940","949","118","10.1016/j.cie.2019.07.002","https://www.scopus.com/pages/publications/85068408420?origin=resultslist","Article","Final","","Scopus","2-s2.0-85068408420"
"Akour I.; Abukhait R.; Alzoubi H.M.; Farzaneh F.; Yanamandra R.; Al-Ateyat H.","Akour, Iman (6504754448); Abukhait, Rawan (57211803315); Alzoubi, Haitham M. (57195353015); Farzaneh, Farnoosh (60656569200); Yanamandra, Ramakrishna (57190610275); Al-Ateyat, Heba (60655954800)","6504754448; 57211803315; 57195353015; 60656569200; 57190610275; 60655954800","Demand Forecasting in Supply Chains Using AI","2025","2025 International Conference on Business Intelligence for Technology Innovation, ICBITI 2025","","","","","","0","10.1109/ICBITI65527.2025.11500782","https://www.scopus.com/pages/publications/105040585870?origin=resultslist","Conference paper","Final","","Scopus","2-s2.0-105040585870"
"Shruthi M.; Prabhu S.; Pai P.Y.; Bhandage V.","Shruthi, M. (59942186100); Prabhu, Srikanth (57197645702); Pai, P. Yogesh (60346284700); Bhandage, Venkatesh (57202333193)","59942186100; 57197645702; 60346284700; 57202333193","Harnessing Technological Solutions to Address Growing Demand for Healthcare Services: A Review","2026","Lecture Notes in Networks and Systems","1488 LNNS","","","321","332","0","10.1007/978-981-96-8309-3_22","https://www.scopus.com/pages/publications/105028323158?origin=resultslist","Conference paper","Final","","Scopus","2-s2.0-105028323158"
"Alakaş H.M.; Eren T.","Alakaş, Hacı Mehmet (59198038300); Eren, Tamer (6602578670)","59198038300; 6602578670","Using Artificial Intelligence in Health and Medical Supply Chains","2023","Accounting, Finance, Sustainability, Governance and Fraud","","","","63","78","0","10.1007/978-981-99-1818-8_6","https://www.scopus.com/pages/publications/85156102923?origin=resultslist","Book chapter","Final","","Scopus","2-s2.0-85156102923"
