"Authors","Author full names","Author(s) ID","Title","Year","Source title","Volume","Issue","Art. No.","Page start","Page end","Cited by","DOI","Link","Document Type","Publication Stage","Open Access","Source","EID"
"Zhang X.; Zhang Q.; Chang Q.","Zhang, Xiao (60075175800); Zhang, Qinyuan (59920859100); Chang, Qi (59669575700)","60075175800; 59920859100; 59669575700","Research on Upgrading and Optimizing Strategy of Dual-Channel Supply Chain of Fresh Agricultural Products Empowered by Digital Economy","2025","Learning and Analytics in Intelligent Systems","53","","","687","696","0","10.1007/978-3-031-99477-7_55","https://www.scopus.com/pages/publications/105014470672?origin=resultslist","Conference paper","Final","","Scopus","2-s2.0-105014470672"
"Alzhrani R.F.; Alrasheed M.; Alzammam I.; Alruthia Y.","Alzhrani, Riyad F. (57204562645); Alrasheed, Marwan (57212252497); Alzammam, Ibrahim (60252962700); Alruthia, Yazed (57115555700)","57204562645; 57212252497; 60252962700; 57115555700","Sterile injectable products shortage in Saudi Arabia: a survey-based cross-sectional study","2025","Saudi Pharmaceutical Journal","33","6","53","","","0","10.1007/s44446-025-00053-z","https://www.scopus.com/pages/publications/105025718113?origin=resultslist","Article","Final","All Open Access; Gold Open Access; Green Open Access","Scopus","2-s2.0-105025718113"
"Wang J.; Sun D.; Zhu W.; Lu H.","Wang, Jianzhou (56380147600); Sun, Donghuai (7403968632); Zhu, Wenjin (55574517800); Lu, Haiyan (7404842588)","56380147600; 7403968632; 55574517800; 7404842588","Application of SVM combined with mackov chain for inventory prediction in supply chain","2008","2008 International Conference on Wireless Communications, Networking and Mobile Computing, WiCOM 2008","","","4679451","","","6","10.1109/WiCom.2008.1543","https://www.scopus.com/pages/publications/58049122826?origin=resultslist","Conference paper","Final","","Scopus","2-s2.0-58049122826"
"Siswanto N.; Wangsa I.D.; Baihaqy A.R.; Suwignjo P.; Yu V.F.","Siswanto, Nurhadi (35146806500); Wangsa, Ivan Darma (57193543947); Baihaqy, Ahmed Raecky (59220877700); Suwignjo, Patdono (6508334393); Yu, Vincent F. (24330397100)","35146806500; 57193543947; 59220877700; 6508334393; 24330397100","An analytical review of blood supply chain management literature through science mapping and strategic diagrams","2025","Healthcare Analytics","8","","100433","","","1","10.1016/j.health.2025.100433","https://www.scopus.com/pages/publications/105020979942?origin=resultslist","Review","Final","All Open Access; Gold Open Access; Green Open Access","Scopus","2-s2.0-105020979942"
"Jackson I.; Ivanov D.; Dolgui A.; Namdar J.","Jackson, Ilya (57204778322); Ivanov, Dmitry (56350235000); Dolgui, Alexandre (57201190890); Namdar, Jafar (56734557500)","57204778322; 56350235000; 57201190890; 56734557500","Generative artificial intelligence in supply chain and operations management: a capability-based framework for analysis and implementation","2024","International Journal of Production Research","62","17","","6120","6145","330","10.1080/00207543.2024.2309309","https://www.scopus.com/pages/publications/85184254709?origin=resultslist","Article","Final","All Open Access; Bronze Open Access; Green Open Access","Scopus","2-s2.0-85184254709"
"Zhang Y.; Joneurairatana E.; Vongphantuset J.","Zhang, Yunfan (60080091200); Joneurairatana, Eakachat (57211408499); Vongphantuset, Jirawat (57218312061)","60080091200; 57211408499; 57218312061","An AI-Driven Decision Support Framework for Ergonomic Optimization in Fashion Manufacturing: Integrating Predictive Analytics and MCDM Techniques","2024","Decision Making: Applications in Management and Engineering","7","1","","786","802","1","10.31181/dmame7120241449","https://www.scopus.com/pages/publications/105015045246?origin=resultslist","Article","Final","","Scopus","2-s2.0-105015045246"
"Brandtner P.; Dakon M.","Brandtner, Patrick (55415699500); Dakon, Michael (60169151500)","55415699500; 60169151500","AI-Powered Forecasting Under Disruption: Lessons from the Covid-19 Crisis for Adaptive Supply Chains","2025","Lecture Notes in Networks and Systems","1553 LNNS","","","129","145","2","10.1007/978-3-031-99958-1_10","https://www.scopus.com/pages/publications/105021008531?origin=resultslist","Conference paper","Final","","Scopus","2-s2.0-105021008531"
"Avinash B.M.; Megha B.; Potluri R.M.","Avinash, B.M. (59179380700); Megha, B. (58651056200); Potluri, Rajasekhara Mouly (55789154600)","59179380700; 58651056200; 55789154600","Integration of Blockchain Technology and Explainable Artificial Intelligence in Supply Chains: Transforming Transparency and Efficiency","2025","Explainable AI and Blockchain for Secure and Agile Supply Chains: Enhancing Transparency, Traceability, and Accountability","","","","47","62","1","10.1201/9781003497363-4","https://www.scopus.com/pages/publications/105004524801?origin=resultslist","Book chapter","Final","","Scopus","2-s2.0-105004524801"
"Omer R.I.A.","Omer, Rehab Ibrahim Ahmed (60059054100)","60059054100","Enhancing supply chain efficiency and decision-making with cloud-based predictive analytics","2025","Cloud Computing's Transformative Power in Computing Environments","","","","433","465","0","10.4018/979-8-3693-9984-2.ch014","https://www.scopus.com/pages/publications/105013901900?origin=resultslist","Book chapter","Final","","Scopus","2-s2.0-105013901900"
"Bhende M.; Raghavendra G.; Jadhav B.; Suriya M.; Kumar B.V.; Priyanka T.P.","Bhende, Manisha (57212697259); Raghavendra, G. (59418942400); Jadhav, Babasaheb (57798076100); Suriya, M. (57201965661); Kumar, Bura Vijay (57196374291); Priyanka, Thella Preethi (59983195400)","57212697259; 59418942400; 57798076100; 57201965661; 57196374291; 59983195400","AI-Powered Smart Supply Chains and Logistics Optimization","2025","Proceedings of the 6th International Conference on Electronics and Sustainable Communication Systems, ICESC 2025","","","","2198","2204","0","10.1109/ICESC65114.2025.11212574","https://www.scopus.com/pages/publications/105022653590?origin=resultslist","Conference paper","Final","","Scopus","2-s2.0-105022653590"
"Yu R.; Liu F.; Cheng T.C.E.; Xu X.","Yu, RuiHui (57944518700); Liu, FeiXue (59772007900); Cheng, T.C.E. (60248640200); Xu, Xiaoyan (59520188800)","57944518700; 59772007900; 60248640200; 59520188800","AI-Blockchain synergy for resilient agricultural supply chains: an evolutionary game analysis","2026","International Journal of Production Research","64","8","","3244","3270","3","10.1080/00207543.2025.2604309","https://www.scopus.com/pages/publications/105025352477?origin=resultslist","Article","Final","","Scopus","2-s2.0-105025352477"
"Saltalamacchia M.; Hameed H.B.; Vigorelli L.G.","Saltalamacchia, Mattia (58493979400); Hameed, Hameem Bin (57216832204); Vigorelli, Lorenzo Giovanni (60138433500)","58493979400; 57216832204; 60138433500","Artificial Intelligence and Supply Chain revolution: A Bibliometric review of the literature","2025","Proceedings of the Summer School Francesco Turco","","","","","","0","","https://www.scopus.com/pages/publications/105018645443?origin=resultslist","Conference paper","Final","","Scopus","2-s2.0-105018645443"
"Nilaish N.; Tiwari B.","Nilaish, Nilaish (57269751700); Tiwari, Bhupendra (59462133700)","57269751700; 59462133700","Artificial intelligence applications in supply chain risk management for reliable operations","2025","Risk, Reliability and Resilience in Operations Management","","","","183","200","0","10.1016/B978-0-443-29812-7.00009-7","https://www.scopus.com/pages/publications/105011224510?origin=resultslist","Book chapter","Final","","Scopus","2-s2.0-105011224510"
"Agrawal K.; Kumar N.","Agrawal, Kushagra (58669364400); Kumar, Navneet (55220040100)","58669364400; 55220040100","AI-ML Applications in Agriculture and Food Processing","2025","Sustainable Development Goals Series","Part F102","","","21","37","6","10.1007/978-3-031-76758-6_2","https://www.scopus.com/pages/publications/86000497751?origin=resultslist","Book chapter","Final","","Scopus","2-s2.0-86000497751"
"Shen R.; Zhou F.; Ye X.; Zhong L.; Feng S.","Shen, Ruilin (59325254800); Zhou, Fuken (57202399093); Ye, Xiaoying (57989758300); Zhong, Lun (59326313500); Feng, Siyuan (59325782400)","59325254800; 57202399093; 57989758300; 59326313500; 59325782400","Research on the application of artificial intelligence technology in supply chain management","2024","E3S Web of Conferences","565","","03017","","","1","10.1051/e3sconf/202456503017","https://www.scopus.com/pages/publications/85203847623?origin=resultslist","Conference paper","Final","All Open Access; Gold Open Access; Green Open Access","Scopus","2-s2.0-85203847623"
"Murungu E.","Murungu, Edwick (59449996700)","59449996700","Generative AI and Trade in Africa: Opportunities and Challenges","2025","OIDA International Journal of Sustainable Development","18","2","","29","40","5","","https://www.scopus.com/pages/publications/85213537494?origin=resultslist","Article","Final","","Scopus","2-s2.0-85213537494"
"Gummadi V.; Sayana R.","Gummadi, Venkata (59420736400); Sayana, Raghavendra (59546572000)","59420736400; 59546572000","Data science applications in sustainable supply chain","2025","AI-Enabled Sustainable Innovations in Education and Business","","","","299","318","0","10.4018/979-8-3373-3952-8.ch013","https://www.scopus.com/pages/publications/105005134593?origin=resultslist","Book chapter","Final","","Scopus","2-s2.0-105005134593"
"Ahtasham Mushtaq M.; Anis Noor M.; Santillo L.C.; Verde R.","Ahtasham Mushtaq, M. (59965221000); Anis Noor, M. (59966171500); Santillo, Liberatina Carmela (6508303532); Verde, Raffaele (59500812600)","59965221000; 59966171500; 6508303532; 59500812600","Implementing AI for Dynamic Demand Forecasting in Lean Healthcare Logistics: A Case Study Approach","2025","Lecture Notes in Bioengineering","","","","269","282","0","10.1007/978-3-031-82923-9_26","https://www.scopus.com/pages/publications/105009228681?origin=resultslist","Conference paper","Final","","Scopus","2-s2.0-105009228681"
"Didwania R.; Mishra S.K.; Shukla S.; Verma R.; Dhanda N.","Didwania, Rishabh (59258444400); Mishra, Sanat Kumar (59545145000); Shukla, Satvik (59472137200); Verma, Rajat (57225817328); Dhanda, Namrata (55440790600)","59258444400; 59545145000; 59472137200; 57225817328; 55440790600","Role of AI in Supply Chain Management and Bio-Informatics Sector","2025","The Confluence of Cryptography, Blockchain and Artificial Intelligence","","","","137","163","0","10.1201/9781032711515-7","https://www.scopus.com/pages/publications/105001884573?origin=resultslist","Book chapter","Final","","Scopus","2-s2.0-105001884573"
"Vijayakumar K.; Anto Gracious L.A.","Vijayakumar, K. (59171881200); Anto Gracious, L.A. (38661095100)","59171881200; 38661095100","Optimizing Demand Forecasting and Inventory Management With AI-Driven Solutions","2024","Innovations in Green and Energy-Efficient Warehousing","","","","111","134","0","10.4018/979-8-3373-3176-8_5","https://www.scopus.com/pages/publications/105027486723?origin=resultslist","Book chapter","Final","","Scopus","2-s2.0-105027486723"
"Jabri N.; Benzakour I.; Kortbi H.E.; Daoud M.","Jabri, Nada (59931134500); Benzakour, Imane (60320808800); Kortbi, Hajar El (60609402900); Daoud, Miloud (57483956300)","59931134500; 60320808800; 60609402900; 57483956300","Generative AI in startup supply chains: A literature review on forecasting, inventory, and entrepreneurial performance","2025","2025 IEEE International Conference on Advanced Technologies in Supply Chain Management, ATSCM 2025","","","","","","0","10.1109/ATSCM67505.2025.11473652","https://www.scopus.com/pages/publications/105037447626?origin=resultslist","Conference paper","Final","","Scopus","2-s2.0-105037447626"
"Selvakumar S.; Renugadevi G.; Vinishah N.; Yashwanth R.","Selvakumar, S. (57210765845); Renugadevi, G. (57224323737); Vinishah, N. (59209827300); Yashwanth, R. (59210893500)","57210765845; 57224323737; 59209827300; 59210893500","Sales Forecasting Based on Time Series Analysis","2024","Proceedings of 2024 International Conference on Science, Technology, Engineering and Management, ICSTEM 2024","","","","","","3","10.1109/ICSTEM61137.2024.10560659","https://www.scopus.com/pages/publications/85197917609?origin=resultslist","Conference paper","Final","","Scopus","2-s2.0-85197917609"
"Nabli H.; Ghannem A.; Djemaa R.B.; Sliman L.","Nabli, Hajer (57194511675); Ghannem, Abir (58889623700); Djemaa, Raoudha Ben (25823067800); Sliman, Layth (26025392800)","57194511675; 58889623700; 25823067800; 26025392800","How innovative technologies shape the future of pharmaceutical supply chains","2025","Computers and Industrial Engineering","199","","110745","","","10","10.1016/j.cie.2024.110745","https://www.scopus.com/pages/publications/85210135452?origin=resultslist","Short survey","Final","","Scopus","2-s2.0-85210135452"
"Kiranmai M.V.S.V.; Panduro-Ramirez J.; Dhyani A.; Reddy G.S.; Al-Taee M.; Alazzam M.B.","Kiranmai, M.V.S.V. (57208421913); Panduro-Ramirez, Jeidy (57219417524); Dhyani, Anubhuti (58237504300); Reddy, G. Swamy (55322883800); Al-Taee, Mustafa (58733799600); Alazzam, Malik Bader (56814920200)","57208421913; 57219417524; 58237504300; 55322883800; 58733799600; 56814920200","The Impact of Machine Learning (ML) Optimization of supply chain management domain","2023","2023 3rd International Conference on Advance Computing and Innovative Technologies in Engineering, ICACITE 2023","","","","932","936","5","10.1109/ICACITE57410.2023.10182817","https://www.scopus.com/pages/publications/85178298993?origin=resultslist","Conference paper","Final","","Scopus","2-s2.0-85178298993"
"Bajaj P.; Kumar L.; Anuradha; Nainwal A.; Muni K.M.; Singh M.","Bajaj, Parveen (57192098362); Kumar, Lalit (59406914300); Anuradha (60609683200); Nainwal, Ankita (57960482800); Muni, Kumari Mayko (59942675200); Singh, Manmohan (57199045242)","57192098362; 59406914300; 60609683200; 57960482800; 59942675200; 57199045242","AI-Powered Inventory Management: Enhancing Forecast Accuracy and Operational Efficiency in Modern Supply Chains","2025","Proceedings - 2025 IEEE 1st International Conference on Smart Innovations in Systems, Infrastructure, Mechanical, Power, AI and Computing Technologies, SISIMPACT 2025","","","","541","547","0","10.1109/SISIMPACT67725.2025.11439051","https://www.scopus.com/pages/publications/105037431163?origin=resultslist","Conference paper","Final","","Scopus","2-s2.0-105037431163"
"Alzoubi H.M.; Tan C.L.; Alfalasi H.; Alrababah H.; Momani H.R.; Warrad L.; Masoud K.","Alzoubi, Haitham M. (57195353015); Tan, Cheng Ling (50862176100); Alfalasi, Hamad (58763852200); Alrababah, Hamza (57373651800); Momani, Hazim Ryad (60656582800); Warrad, Lina (57214222723); Masoud, Kahled (60656075100)","57195353015; 50862176100; 58763852200; 57373651800; 60656582800; 57214222723; 60656075100","AI for Efficient Warehouse Management in Supply Chains","2025","2025 International Conference on Business Intelligence for Technology Innovation, ICBITI 2025","","","","","","0","10.1109/ICBITI65527.2025.11501022","https://www.scopus.com/pages/publications/105040557138?origin=resultslist","Conference paper","Final","","Scopus","2-s2.0-105040557138"
"Berbiche N.; Hlyal M.; Alami J.E.","Berbiche, Nawfal (57217603372); Hlyal, Mustapha (56523339000); Alami, Jamila El (55987066300)","57217603372; 56523339000; 55987066300","Enhancing Supply Chain Resilience and Efficiency through Fuzzy Logic-based Decision-Making Automation in Volatile Environments","2024","Ingenierie des Systemes d'Information","29","1","","191","203","14","10.18280/isi.290120","https://www.scopus.com/pages/publications/85188218422?origin=resultslist","Article","Final","All Open Access; Hybrid Gold Open Access","Scopus","2-s2.0-85188218422"
"AL-Obaidly G.A.","AL-Obaidly, Ghoson Abdulaziz (58693541000)","58693541000","Challenges and Opportunities in AI-Driven Supply Chain Sustainability: A Review Article","2025","World Sustainability Series","Part F1151","","","339","354","1","10.1007/978-3-032-00098-9_28","https://www.scopus.com/pages/publications/105022126585?origin=resultslist","Book chapter","Final","","Scopus","2-s2.0-105022126585"
"Tsintotas K.A.; Moutsis S.N.; Kansizoglou I.; Konstantinidis F.K.; Gasteratos A.","Tsintotas, Konstantinos A. (57204057583); Moutsis, Stavros N. (58624149000); Kansizoglou, Ioannis (57212487280); Konstantinidis, Fotios K. (57221260835); Gasteratos, Antonios (6701673537)","57204057583; 58624149000; 57212487280; 57221260835; 6701673537","The Advent of AI in Modern Supply Chain","2025","Communications in Computer and Information Science","2110 CCIS","","","333","343","3","10.1007/978-3-031-69344-1_25","https://www.scopus.com/pages/publications/85208223864?origin=resultslist","Conference paper","Final","","Scopus","2-s2.0-85208223864"
"Zabraoui O.; Chafi A.; Alami S.K.","Zabraoui, Oussama (59940277500); Chafi, Anas (57193552929); Alami, Salaheddine Kammouri (23094092200)","59940277500; 57193552929; 23094092200","Integrating Artificial Intelligence in Supply Chain: Enhancements and Challenges","2025","2025 5th International Conference on Innovative Research in Applied Science, Engineering and Technology, IRASET 2025","","","","","","1","10.1109/IRASET64571.2025.11008164","https://www.scopus.com/pages/publications/105007786457?origin=resultslist","Conference paper","Final","","Scopus","2-s2.0-105007786457"
"Ferreira A.C.A.; Francisco M.B.; Pinho A.F.D.","Ferreira, Ana Claudia Andrade (60078838000); Francisco, Matheus Brendon (57219553472); Pinho, Alexandre Ferreira De (24586945600)","60078838000; 57219553472; 24586945600","The Use of Artificial Intelligence in Supply Chain Management: Systematic Literature Review and Future Research Directions","2025","IEEE Access","13","","","157828","157841","6","10.1109/ACCESS.2025.3603866","https://www.scopus.com/pages/publications/105014622090?origin=resultslist","Review","Final","All Open Access; Gold Open Access; Green Open Access","Scopus","2-s2.0-105014622090"
"Vieira B.P.; Frazzon E.M.","Vieira, Brandow Padilha (60141532000); Frazzon, Enzo Morosini (35791521500)","60141532000; 35791521500","Application of Reinforcement Learning to Improve Finished Goods Inventory Management: A Systematic Review","2025","IFAC-PapersOnLine","59","10","","841","846","1","10.1016/j.ifacol.2025.09.143","https://www.scopus.com/pages/publications/105018802155?origin=resultslist","Conference paper","Final","All Open Access; Gold Open Access","Scopus","2-s2.0-105018802155"
"Islam S.; Veronica B.; Thaseen S.","Islam, Shaziya (57204590669); Veronica, Benita (57211492275); Thaseen, Sumaiya (60422779300)","57204590669; 57211492275; 60422779300","The Smart Shift: Generative AI and the Rise of Human AI Productivity","2025","2025 International Conference on Computational Intelligence and Knowledge Economy, ICCIKE 2025","","","","427","432","0","10.1109/ICCIKE67021.2025.11318245","https://www.scopus.com/pages/publications/105032664195?origin=resultslist","Conference paper","Final","","Scopus","2-s2.0-105032664195"
"Ahmed A.; Fahmy H.; Ragab M.; Askar N.; Gadallah Y.","Ahmed, Aya (60046456500); Fahmy, Hana (60519249800); Ragab, Mostafa (60519608800); Askar, Noran (60519339700); Gadallah, Yasser (24780502000)","60046456500; 60519249800; 60519608800; 60519339700; 24780502000","A Novel AI-based Smart Supply Chain Management System","2025","2025 7th Computing, Communications and IoT Applications Conference, ComComAp 2025","","","","56","63","0","10.1109/ComComAp68359.2025.11353151","https://www.scopus.com/pages/publications/105033482164?origin=resultslist","Conference paper","Final","","Scopus","2-s2.0-105033482164"
"Bhat D.; Thorat N.; Sudheendra Mouli H.C.; Ganesha B.B.; Sutaria K.; Kannan S.","Bhat, Devidas (57210970005); Thorat, Ninad (60405165900); Sudheendra Mouli, H.C. (60405166000); Ganesha, B.B. (55316976400); Sutaria, Kamal (56600573200); Kannan, Sathish (57200582066)","57210970005; 60405165900; 60405166000; 55316976400; 56600573200; 57200582066","Digital Transformation in the Supply Chain: Leveraging AI and Blockchain for Operational Efficiency","2025","International Conference on Intelligent Communication Networks and Computational Techniques, ICICNCT 2025","","","","","","0","10.1109/ICICNCT66124.2025.11233126","https://www.scopus.com/pages/publications/105030439933?origin=resultslist","Conference paper","Final","","Scopus","2-s2.0-105030439933"
"Eldred M.E.; Thatcher J.; Rehman A.; Gee I.; Suboyin A.","Eldred, Morgan Edward (57205442891); Thatcher, Jimmy (57205435009); Rehman, Abdul (57651349300); Gee, Ivan (57329917100); Suboyin, Abhijith (57203937073)","57205442891; 57205435009; 57651349300; 57329917100; 57203937073","Leveraging AI for Inventory Management and Accurate Forecast-An Industrial Field Study","2023","Society of Petroleum Engineers - SPE Symposium: Leveraging Artificial Intelligence to Shape the Future of the Energy Industry, AIS 2023","","","","","","22","10.2118/214457-MS","https://www.scopus.com/pages/publications/85147331960?origin=resultslist","Conference paper","Final","","Scopus","2-s2.0-85147331960"
"Kanwal N.; Zhang M.; Zeb M.; Hussain M.; Wang D.","Kanwal, Nida (59301918300); Zhang, Min (36047275100); Zeb, Mustafa (59302002000); Hussain, Mudassar (58662995700); Wang, Dayuan (57306572700)","59301918300; 36047275100; 59302002000; 58662995700; 57306572700","Revolutionizing food safety in the airline industry: AI-powered smart solutions","2025","Trends in Food Science and Technology","159","","104970","","","10","10.1016/j.tifs.2025.104970","https://www.scopus.com/pages/publications/86000752458?origin=resultslist","Review","Final","","Scopus","2-s2.0-86000752458"
"Allam H.; Lazaro E.J.; Davison C.B.; Truell A.D.","Allam, Hesham (36447519700); Lazaro, Edward J. (60097538700); Davison, Christopher B. (57193506117); Truell, Allen D. (6505778678)","36447519700; 60097538700; 57193506117; 6505778678","Enhancing supply chain efficiency through AI-driven demand forecasting: a comprehensive analysis","2025","Issues in Information Systems","26","4","","65","77","0","10.48009/4_iis_2025_107","https://www.scopus.com/pages/publications/105015890207?origin=resultslist","Article","Final","All Open Access; Gold Open Access","Scopus","2-s2.0-105015890207"
"Giaconia C.; Chamas A.","Giaconia, Cettina (6601963304); Chamas, Aziz (57698417500)","6601963304; 57698417500","MySTOCKS: Multi-Modal Yield eSTimation System of in-prOmotion Commercial Key-ProductS","2025","Computation","13","3","67","","","0","10.3390/computation13030067","https://www.scopus.com/pages/publications/105001119376?origin=resultslist","Article","Final","All Open Access; Gold Open Access; Green Open Access","Scopus","2-s2.0-105001119376"
"Sudha S.; Natarajan C.; Meenakshi K.; Saravanan A.; Seal S.; Sangeetha S.","Sudha, S. (57130359300); Natarajan, C. (57213874941); Meenakshi, K. (57200312751); Saravanan, A. (56681958500); Seal, Sudeshna (58851894100); Sangeetha, S. (57201067555)","57130359300; 57213874941; 57200312751; 56681958500; 58851894100; 57201067555","Optimizing Supply Chain Management Using Ensemble Learning-Based Predictive Analytics","2025","Proceedings of the 2025 3rd International Conference on Advances in Computation, Communication and Information Technology, ICAICCIT 2025","","","","450","454","0","10.1109/ICAICCIT68829.2025.11434307","https://www.scopus.com/pages/publications/105036174165?origin=resultslist","Conference paper","Final","","Scopus","2-s2.0-105036174165"
"Dawi N.B.M.; Akhtar M.; Namazi H.","Dawi, Norazryana Binti Mat (56285352700); Akhtar, Mohammad (54882145600); Namazi, Hamidreza (55308641800)","56285352700; 54882145600; 55308641800","APPLICATION OF MATHEMATICAL MODELING IN SUPPLY CHAIN MANAGEMENT: A REVIEW","2025","Fractals","33","7","2530007","","","0","10.1142/S0218348X25300077","https://www.scopus.com/pages/publications/105010165143?origin=resultslist","Review","Final","","Scopus","2-s2.0-105010165143"
"Olasiuk H.; Kumar S.; Singh S.; Nagpal G.; Ganushchak T.","Olasiuk, Hanna (57208442647); Kumar, Sanjeev (58284989500); Singh, Sudhanshu (57200218253); Nagpal, Gaurav (57221603068); Ganushchak, Tetiana (57192700047)","57208442647; 58284989500; 57200218253; 57221603068; 57192700047","Exploring the Thematic Clusters of Artificial Intelligence Applications in Supply Chains Using Topic Modelling and Text Mining: A Machine Learning Insight","2023","Proceedings of the 4th IEEE International Conference on Smart Technologies in Computing, Electrical and Electronics, ICSTCEE 2023","","","","","","1","10.1109/ICSTCEE60504.2023.10584847","https://www.scopus.com/pages/publications/85199533481?origin=resultslist","Conference paper","Final","","Scopus","2-s2.0-85199533481"
"Mustafa M.A.S.","Mustafa, Mustafa A. S. (57210825795)","57210825795","Predictive Reliability-Driven Optimization of Spare Parts Management in Aircraft Fleets Using AI, IoT, and Digital Twin Technologies","2025","Journal of Engineering Management and Systems Engineering","4","3","","218","236","7","10.56578/jemse040305","https://www.scopus.com/pages/publications/105026172823?origin=resultslist","Article","Final","All Open Access; Hybrid Gold Open Access","Scopus","2-s2.0-105026172823"
"Jaipuria S.; Mahapatra S.S.","Jaipuria, Sanjita (55888601800); Mahapatra, Siba Sankar (34881914000)","55888601800; 34881914000","A study on behaviour of bullwhip effect in (R, S) inventory control system considering DWT-MGGP demand forecasting model","2019","Journal of Modelling in Management","14","2","","385","407","12","10.1108/JM2-04-2018-0053","https://www.scopus.com/pages/publications/85061317349?origin=resultslist","Article","Final","","Scopus","2-s2.0-85061317349"
